<?xml version="1.0" encoding="UTF-8"?>
<cukraszdak xmlns:xsi="http://www.w3.org/2001/XMLSchema-instance" xsi:noNamespaceSchemaLocation="XMLSchemaBFHRGP.xsd">
	<cukraszda>
		<cukraszda_adatok CukraszdaID="1">
			<nev>Stühmer cukrászda</nev>
			<nyitvatartas>10:00-17:00</nyitvatartas>
			<weboldal>stuhmer.hu</weboldal>
			<telefonszam>0636517372</telefonszam>
		</cukraszda_adatok>

		<futar FutarID="1">
			<nev>Kis Béla</nev>
			<telefonszam>06301234567</telefonszam>
			<CukraszdaID>1</CukraszdaID>
		</futar>
		<futar FutarID="2">
			<nev>Nagy Béla</nev>
			<telefonszam>06707654321</telefonszam>
			<CukraszdaID>1</CukraszdaID>
		</futar>

		<termek TermekID="1">
			<nev>Melódia</nev>
			<tipus>szelet</tipus>
			<egyseg_ar>500</egyseg_ar>
			<CukraszdaID>1</CukraszdaID>
		</termek>
		<termek TermekID="2">
			<nev>Korfu</nev>
			<tipus>szelet</tipus>
			<egyseg_ar>450</egyseg_ar>
			<CukraszdaID>1</CukraszdaID>
		</termek>
		<termek TermekID="3">
			<nev>Sós-mogyorós barack zsúr</nev>
			<tipus>torta</tipus>
			<egyseg_ar>4500</egyseg_ar>
			<CukraszdaID>1</CukraszdaID>
		</termek>

		<vevo VevoID="1">
			<nev>Nagy Béla</nev>
			<iranyitoszam>3300</iranyitoszam>
			<varos>Eger</varos>
			<utca>Merengő</utca>
			<hazszam>1</hazszam>
			<telefonszam>06309876532</telefonszam>
		</vevo>
		<vevo VevoID="2">
			<nev>Nagy János</nev>			
			<iranyitoszam>3535</iranyitoszam>
			<varos>Miskolc</varos>
			<utca>Eper</utca>
			<hazszam>2</hazszam>		
			<telefonszam>06608884441</telefonszam>
		</vevo>

		<rendeles RendelesID="1">
			<mennyiseg>2</mennyiseg>
			<fizetendo_osszeg>1000</fizetendo_osszeg>
			<TermekID>1</TermekID>
			<VevoID>1</VevoID>
		</rendeles>

		<rendeles RendelesID="2">
			<mennyiseg>1</mennyiseg>
			<fizetendo_osszeg>4500</fizetendo_osszeg>
			<TermekID>3</TermekID>
			<VevoID>2</VevoID>
		</rendeles>

		<rendeles RendelesID="3">
			<mennyiseg>3</mennyiseg>
			<fizetendo_osszeg>1350</fizetendo_osszeg>
			<TermekID>2</TermekID>
			<VevoID>1</VevoID>
		</rendeles>

		<kartya Kartyaszam="1177339100111222">
			<tipus>SZÉP</tipus>
			<lejarati_datum>2022-11-30</lejarati_datum>
			<bank>OTP</bank>
			<VevoID>1</VevoID>
		</kartya>
		<kartya Kartyaszam="117733901234567">
			<tipus>Bank</tipus>
			<lejarati_datum>2023-05-02</lejarati_datum>
			<bank>MKB</bank>
			<VevoID>1</VevoID>
		</kartya>
		<kartya Kartyaszam="8823569123547632">
			<tipus>SZÉP</tipus>
			<lejarati_datum>2021-12-31</lejarati_datum>
			<bank>KH</bank>
			<VevoID>2</VevoID>
		</kartya>
	</cukraszda>
</cukraszdak>